ID,Character,Original Text,Reference,Translation
__translator__,,Translator,,naoshka_v
__language__,,Language,en_US,ru_RU
char-1,格拉尼,格拉尼,Grani,Грани
char-2,可萝尔,可萝尔,Carol,Кэрол
char-3,赏金猎人,赏金猎人,Bounty Hunter,Охотник за головами
char-4,？？？,？？？,???,???
char-5,大鲍勃,大鲍勃,Big Bob,Большой Боб
char-6,“上尉”,“上尉”,'Captain',«Капитан»
,,,,
line-7,格拉尼,可恶，这些赏金猎人真是缠人！,"Damn, these bounty hunters sure are persistent!","Чёрт, какие же они настойчивые!"
line-9,可萝尔,呀！虫子！！,Eek! Bugs!!,Иик! Жуки!
line-10,可萝尔,好恶心！,Gross!,Гадость!
line-12,格拉尼,呜呃，黏黏糊糊的......,"Yuck, they're all sticky...","Фу, они все липкие..."
line-14,赏金猎人,快把她们包围起来！别让她们又逃了！,Hurry up and surround them! Don't let them escape this time!,"Быстрее, окружите их! Не дайте им сбежать на этот раз!"
line-15,赏金猎人,打不过那个小个子没所谓！缠住他，然后把那个村长小姑娘抓回来！,Don't worry if you can't beat that kid. Just keep him occupied until you can capture that village girl!,"Не переживайте, даже если не сможете победить того пацана. Просто займите его, пока не поймаем девчонку из деревни!"
line-17,格拉尼,可萝尔！别离开我身边！,Carol! Stay close to me!,Кэрол! Держись рядом со мной!
line-23,可萝尔,唔——！,Ahh...!,Ааа...!
line-31,？？？,你们两个，捂住耳朵！,"Cover your ears, you two!","Заткните уши, вы двое!"
line-34,赏金猎人,啊？你是谁？哪冒出来的大胖子啊！,"Huh? Who are you? Where'd you come from, fatty?","А? Ты кто? Откуда ты вылез, жирдяй?"
line-43,赏金猎人,噗啊啊啊啊——！,Gyaaaaahhh—!,Гьяаааах!
line-45,？？？,哼，胖子？我只是壮而已。,Hmph. Fatty? I'm just big-boned.,Хмпф. Жирдяй? У меня просто кости широкие.
line-51,格拉尼,那是什么炸弹爆炸了吗？！,That sounded like... explosives?!,Этот звук... Взрывчатка?!
line-53,？？？,震撼弹而已，声音很大，没杀伤力的！不过用来驱散这些虫子还有野兽都很有效！,"Just a flashbang. Loud, but not going to kill anyone! Pretty good for scaring away bugs and other critters though!","Простая светошумовая. Бахнет громко, но никого не убьёт! Очень хорошо распугивает жуков и другую мелочь!"
line-54,？？？,趁虫子和那些家伙都被爆炸吓跑，快走！先转移到安全的地方！,Let's get out of here while they're still reeling! We need to find some place safe first!,"Давайте убираться, пока они не пришли в себя! Для начала, нужно найти безопасное место!"
line-56,格拉尼,可萝尔！这次可别再是小阁楼什么的了！,Carol! Don't lead us into some tiny attic this time!,Кэрол! Только не веди нас опять в какой-нибудь крохотный чердак!
line-58,可萝尔,那，来这边！,"Um, over here then!","Эм, тогда сюда!"
line-63,,"晴 \ 能见度 14公里 ","Clear \ Visibility: 14 km ",Ясно \ Видимость: 14 км
line-64,,村外树林,Forest outside the village,Лес за деревней
line-68,可萝尔,这片树林非常偏僻，只有我和我小时候的玩伴知道这里......,These woods are quite remote. Very few people should know their way around here except me and my childhood friends...,"Этот лес достаточно отдалённый. Мало, кто ориентируется здесь, кроме меня и моих друзей из детства..."
line-70,格拉尼,等下，可萝尔，先别放松。,"Hold on, Carol, don't let your guard down yet.","Постой, Кэрол, не расслабляйся пока."
line-75,？？？,哼。,Tch.,Тч.
line-78,？？？,锯子，弹药，爆破物。,"My saw, ammo, and explosives...","Моя пила, патроны, и взрывчатка..."
line-79,？？？,我把这些全放在地上了。这样可以好好谈谈宝藏了吗？,"I've put all my weapons down. Now, can we talk about that treasure?","Я выложил всё своё оружие. Теперь, мы можем поговорить о сокровище?"
line-80,？？？,我也是个赏金猎人，但我没有刚才那些家伙那么贪心。刚才那些充其量只是来跑腿的杂鱼，也不够聪明。,"I'm also a bounty hunter, but I'm not greedy like those guys back there. Those idiots were basically errand boys anyway; they wouldn't have been able to find the treasure regardless.","Я тоже охотник за головами, но не так жаден как те парни. Те идиоты всё равно были, по сути, мальчиками на побегушках; они в любом случае не смогли бы найти сокровище."
line-81,？？？,比起冒着风险抢夺这位村长姑娘，不如主动与你们合作来的更有效率。,"Instead of taking the risk of trying to force the information out of this young chief here, it'd be much more efficient to just work with you.","Вместо того, чтобы пытаться силой выпытать информацию из этой молодой старосты, было бы куда эффективнее просто работать вместе."
line-83,格拉尼,谢谢你刚才帮了我们，但现在不是谈宝藏的时候。,"Thanks for helping us out back there, but we can't discuss the treasure just yet.","Спасибо, что выручил нас, но нам с тобой ещё рано обсуждать сокровища."
line-85,？？？,你不是赏金猎人，不是干这行的，我看得出来。,"You're not a bounty hunter, are you? I can tell from a glance.","Ты не охотник за головами, так ведь? С первого взгляда видно."
line-86,？？？,而我，对这行当了如指掌。,"I, on the other hand, know all the tricks of the trade.","Я же, с другой стороны, знаю все тонкости этого дела."
line-88,格拉尼,滴水村周遭的赏金猎人情况，你也很清楚吗？,"So, I assume you know about the situation with the bounty hunters in Dewville?","И, я полагаю, ты знаешь о ситуации с охотниками за головами в Капели?"
line-90,？？？,托伦团、佛罗茨团、卢布林团、瓦各斯克团——,"Of course. The Torrent Troupe, the Florence Fiends, the Lublin League, the Valk Vanguards...","Конечно. Торнская, Вроцлавская, Люблинская, Вагская группы..."
line-91,？？？,所有的赏金猎人都在整个区域进行地毯式搜索，已经好几天了。说实话，宝藏被他们找到也只是时间问题。,"All the bounty hunters have been scouring this area for the last few days. To be honest, it's only a matter of time until someone finds the treasure.","Все охотники за головами уже несколько дней обыскивают территорию. Честно говоря, это лишь вопрос времени, когда они найдут сокровище."
line-92,？？？,无论哪个赏金猎人找到宝藏，不同派系的赏金猎人绝对会为了争夺宝藏，在这片地区争得头破血流。,"But no matter who finds it, all the different factions are gonna end up spilling blood fighting over it.","Но кто бы его не нашёл, всё закончится кровавой битвой между разными группировками."
line-93,？？？,那时滴水村不但什么好处都拿不到，说不定还会被摧毁得一干二净，你们明白得很。,"At that point, not only will Dewville get nothing in return, but it might even get wiped off the face of the map. I'm sure you two understand that.","И когда это произойдёт, Капель не просто останется ни с чем, она может оказаться стёртой с лица земли. Уверен, вы двое понимаете это."
line-95,格拉尼,......,...,...
line-96,格拉尼,那么，你能为我们提供些什么？,"So, what can you offer us?","Итак, что ты предлагаешь?"
line-98,？？？,野外向导，猎人经验，暗号识别，陷阱拆解，以及多一个的战力。,"I'm experienced in wilderness survival, hunting, cracking codes, dismantling traps, and more. Of course, I can hold my own in a fight.","У меня есть опыт в выживании в дикой природе, охоте, расшифровке кодов, обезвреживании ловушек и много в чём ещё. Разумеется, я могу постоять за себя в битве."
line-99,？？？,不管哪个，都是你们现在急缺的东西。,You two are probably lacking in all of these things.,"Вам двоим, скорее всего, это пригодится."
line-101,格拉尼,那，请问我该怎么称呼你？,"For starters, how should we address you?","Для начала, как к нам тебе обращаться?"
line-103,大鲍勃,叫我大鲍勃。,Call me Big Bob.,Зовите меня Большой Боб.
line-105,格拉尼,嗯，请你稍等，我需要和村长商量一下。,"Uh, give me a second here. I need to talk to the Chief first.","Э, дай нам минутку. Мне нужно поговорить со Старостой."
line-111,格拉尼,这个位置，大鲍勃不会听到我们的谈话。,Big Bob won't be able to hear us from over here.,Большой Боб не услышит нас отсюда.
line-113,可萝尔,我......我信不过一个赏金猎人......,I... can't trust a bounty hunter...,Я... не могу доверять охотнику за головами...
line-114,可萝尔,把我们骗进陷阱，或者和其他赏金猎人串通，这些都是我们没法承受的......,"He could be baiting us into a trap, or working with other bounty hunters. We can't let any of these things happen...","Может быть, это ловушку, или он работает вместе с остальными охотниками головами. Мы не можем позволить такому случиться..."
line-116,格拉尼,可萝尔，你见过这位大鲍勃吗？,"Carol, have you seen this Big Bob before?","Кэрол, ты видела Большого Боба раньше?"
line-118,可萝尔,倒是没有......每个破坏过村庄，甚至来过的赏金猎人，他们的样子，我都记得清清楚楚......,"No... I clearly remember the faces of every single bounty hunter who set foot in our village, especially those that caused us harm.","Нет... Я чётко помню лица всех охотников за головами, пришедших в деревню, особенно тех, кто причиняли вред."
line-120,格拉尼,和他合作，肯定会有风险的。,It'll definitely be risky to work with him.,Сотрудничать с ним рискованно.
line-121,格拉尼,接下来的情况会随时间的推移变得更加复杂。,"However, things are only going to more complicated over time.","Однако, ситуация дальше будет становиться всё опаснее."
line-122,格拉尼,为了早点找到宝藏，我们也许必须借用他的力量。,We might have to work with him if we want to find this treasure as soon as possible.,"Возможно, нам стоит объединиться с ним, если мы хотим найти сокровище как можно скорее."
line-124,可萝尔,那格拉尼，你说的那个同事也能帮上忙吗？,"What about that coworker of yours, Grani? Could she help?","Что насчёт той твоей коллеги, Грани? Она может помочь?"
line-126,格拉尼,不太好说。她不是那么好相处的人，而且她同样也是个赏金猎人。,"Can't say for sure. She's not that easy to get along with. Besides, she's a bounty hunter herself.","Не могу сказать точно. С ней не так просто поладить. Кроме того, она тоже охотница за головами."
line-127,格拉尼,如果可以的话，我想先搞清楚情况，再去找她。,"If possible, I'd like to have the situation under control before I say anything to her.","Если возможно, я бы хотела иметь ситуацию под контролем перед тем как говорить с ней."
line-129,可萝尔,让我想想。,Let me think about it.,Дай мне подумать об этом.
line-130,可萝尔,我不能告诉他埋藏宝藏的地方。我可以分几次告诉他大概的方向，就像在牧兽的脑袋前面挂上粮食一样。,"I can't just straight up tell him where the treasure is. Maybe I can just give him some hints, like dangling a carrot in front of him.","Я не могу прямо сказать ему, где находится сокровище. Может быть, я могу дать ему пару подсказок, как бы помахать морковкой перед носом."
line-131,可萝尔,这样行吗？,Do you think that would work?,"Думаешь, это сработает?"
line-133,格拉尼,嗯，这样做是对的。,"Hmm, that's probably the best option.","Хмм, наверное, это лучший вариант."
line-134,格拉尼,我会盯紧他的。情况不对的话，我会立刻把你送出森林。,"I'll keep an eye on him. If I sense anything wrong, I'll get you out of the forest right away.","Я буду приглядывать за ним. Если почую неладное, я вытащу тебя из леса в ту же секунду."
line-135,格拉尼,可萝尔，你的安全，交给我。,"Carol, I'm going to keep you safe.","Кэрол, я тебя защищу."
line-142,大鲍勃,如何？先给我一个方向吧。,So? At least tell me what the plan is.,Ну что? Хотя бы поделитесь со мной планом.
line-144,格拉尼,我们需要一条能够迅速前往塔拉特山的道路。,We need a route that takes us to Mt. Terrat in the shortest time possible.,Нам нужно пройти к горе Террат в самое кратчайшее время.
line-146,大鲍勃,想要前往塔拉特山，就必须穿过北方这片森林。,"If you want to reach Mt. Terrat, we're going to have the cross the northern part of the forest.","Если хотите дойти до горы Террат, нам необходимо пересечь северную часть леса."
line-147,大鲍勃,那片森林，也是赏金猎人互相争夺的战场。,"Unfortunately, that part of the forest is hotly contest territory for the bounty hunters.","К сожалению, та часть леса сейчас место борьбы разных группировок охотников за головами."
line-148,大鲍勃,想必已经有很多赏金猎人埋伏在那里了。但是我会带你们从安全的路过去。,"I bet there plenty of them out there already waiting to ambush us. However, I'll take you along a safe path.","Готов поспорить, целая орава уже ждёт нас там в засаде. Однако, я проведу вас по безопасному пути."
line-150,格拉尼,鲍勃大叔，想要合作的话，我们是有条件的。,"Big Bob, we have to lay down some conditions before we agree to work with you.","Большой Боб, перед тем как работать с тобой, нам нужно обозначить некоторые условия."
line-152,大鲍勃,当然，这是我们接下来要谈的重点，不是吗？,Of course. Isn't that what we were going to talk about next anyway?,"Конечно. Разве не об этом мы собирались поговорить дальше, в любом случае?"
line-153,大鲍勃,你只要先告诉我，几几分成。,Just tell me how we're going to split the treasure.,"Просто скажите мне, как мы разделим сокровище."
line-163,“上尉”,我不渴！不用给我水！,I'm not thirsty! I don't need your water!,Да не нужна мне твоя вода!
line-165,赏金猎人,好，好，我说上尉，那两个小孩我们还找不找了？,"Fine, fine. Anyway, Captain, are we still gonna keep looking for those two kids?","Ладно, ладно. Кстати, Капитан, Мы всё ещё собираемся продолжать искать тех двоих?"
line-167,“上尉”,怎么可能不找？我们是为了什么才走到今天的？忘了？,What kind of question is that? Did you forget why we're even out here in the first place?,Что это ещё за вопрос? Ты забыл зачем мы приехали сюда в первую очередь?
line-168,“上尉”,这边离城市远得很，通讯信号也和没有一样，虽然支援会来得晚，但是这对其他团也一样的。这可是大好的机会！,"We're a long way from the nearest city, and we barely have any signal here. Even though we probably can't count on backup, the other guys are in the same situation. This is the best chance we're gonna get!","Мы далеко от ближайшего города, и здесь едва ли ловит сигнал. Хотя мы не можем вызвать подкрепление, остальные находятся в такой же ситуации. Лучшего шанса не будет!"
line-170,赏金猎人,可那个怪物也往那个方向去了，我们......,But that monster headed in the same direction too. We...,Но то чудовище пошло в том же направлении. Мы...
line-172,“上尉”,怕什么？虽然那家伙是有点厉害，但是别忘了那边可是我们的地盘。那么多陷阱，有她好受的！,"What are you scared of? She might know how to fight, but don't forget that we know the terrain better than she does. Just wait 'til she discovers all the traps we laid for her!","Чего ты боишься? Может она и знает толк в драках, не забывай, что мы лучше знакомы с этой местностью. Просто подожди, пока она найдёт все ловушки, которые мы расставили!"
line-173,“上尉”,宝藏，我们要拿！怪物，我们也要狩猎！,Treasures exist for us to take! Monsters exist for us to hunt!,"Сокровища существуют, чтобы мы их забрали! Чудовища, чтобы мы их сразили!"
line-174,“上尉”,老子全都要！,I will have it all!,Они все будут наши!